id;nome;sobrenome;cnh;placa;email;contato;endereco;endereco_numero;endereco_complemento;endereco_bairro;cep;status;data
1;Gloves sky blue Oklahoma;robust Engineer;Exclusive Moroccan Dirham card;zero tolerance;Dock_Mohr41@gmail.com;Home;Investor Public-key;Lebanon;Designer Persistent;Handmade 24/7 Re-contextualized;web-enabled invoice withdrawal;bypassing optical;2019-06-05T19:47:59
2;Bedfordshire;Refined Rubber Gloves Algerian Dinar Clothing;open-source turn-key;Sausages;Grady_Howe@hotmail.com;Metal bricks-and-clicks Concrete;Tanzania Fiji Dollar Profound;parsing;Borders content-based;Tasty Customer Human;pink even-keeled;bus Internal AI;2019-06-05T04:42:00
3;invoice Unbranded Cheese;New Zealand Dollar Alabama transform;invoice Home Gloves;Buckinghamshire Ports;Dana.Dare23@hotmail.com;circuit navigate;program alarm;Nevada;Berkshire;dedicated Persevering;Coordinator Cambridgeshire Investor;cross-platform Borders;2019-06-05T09:34:16
4;Cambridgeshire white sensor;Alaska;deposit Chips Applications;uniform PCI back up;Tina_Harber@hotmail.com;Wisconsin Facilitator Incredible;reinvent;eco-centric Bedfordshire mesh;Configuration UIC-Franc;Ergonomic Concrete Soap Zambian Kwacha;Concrete Bedfordshire;portal calculating Metal;2019-06-05T06:24:11
5;France protocol;open-source HDD;Sleek Beauty Auto Loan Account;deposit;Gracie89@hotmail.com;value-added incubate Practical;Argentine Peso implementation;Wallis and Futuna;generating;Computers Small Fresh Gloves back-end;interface;compress lavender Investment Account;2019-06-05T21:22:06
6;Intelligent Granite Shirt Peru deposit;Frozen Analyst card;redundant;content;Aric18@hotmail.com;Refined infomediaries Som;Salad;ROI;Benin;Tuna Response invoice;alarm Jamaica;system Gorgeous Rubber Pants;2019-06-05T19:36:33
7;Steel leading-edge Small;Incredible Fresh Chips;Shoes Music connect;Hollow Shoes systems;Alysson_Morar88@yahoo.com;explicit;Personal Loan Account;Cambridgeshire Norfolk Island;Soap Tasty Metal Sausages Outdoors;invoice multi-byte;incubate deposit Station;parsing Investment Account;2019-06-05T03:43:36
8;invoice teal analyzing;Fantastic;Ergonomic Rubber Chicken;Handcrafted Plastic Shirt quantifying;Evalyn28@gmail.com;Metal Rupiah;Accountability Handmade Cotton Bacon;intermediate Table quantify;Wyoming interface Cotton;quantify;JSON Texas;bandwidth;2019-06-05T05:23:46
9;compress Fantastic Global;Buckinghamshire monetize;Direct;Small Frozen Salad bypassing;Emmanuel_Will95@yahoo.com;Missouri deposit;Gorgeous Money Market Account;Danish Krone parse;neural Wooden Optimization;Tasty Rubber Car mindshare EXE;bandwidth Liaison;program Auto Loan Account Refined;2019-06-05T21:23:54
10;Algerian Dinar Fantastic Fresh Salad;Steel Avon Visionary;exploit transition;User-centric Principal Pennsylvania;Garry48@yahoo.com;mesh system Triple-buffered;Cotton;Advanced grow;Handmade Wooden Cheese Fresh;input Naira;Markets;Glen Refined;2019-06-05T10:44:10
